,24,05,CMP,PCI,ENFXPCI8,LIMPIEZA Y DESINFECCION DE INSTALACIONES Y MEDIOS DE TRANSPORTE,F268PCI,F268PCI_SABANAS NO SON CAMBIADAS DESPUES DE TERMINAR EL TRASLADO DEL PACIENTE ENTRE PACIENTE Y PACIENTE,1.5,1,2.15556,3.23333,0,2,SER3,2024-05-28
,24,05,CMP,PCI,ENFXPCI8,LIMPIEZA Y DESINFECCION DE INSTALACIONES Y MEDIOS DE TRANSPORTE,F270PCI,"F270PCI_NO SE REALIZA LIMPIEZA Y DESINFECCION DE BAUMANOMETROS, ESTETOSCOPIOS, TERMOMETROS, BOMBA DE INFUSION O OTOSCOPIO",2.57143,3,3.26667,25.2,0,2,SER3,2024-05-28
,24,05,CMP,PCI,ENFXPCI8,LIMPIEZA Y DESINFECCION DE INSTALACIONES Y MEDIOS DE TRANSPORTE,F272PCI,F272PCI_NO SE REALICE LIMPIEZA Y DESINFECCION DE SUPERFICIES INTERNAS DEL EQUIPO MEDICO,1.5,1,2.15556,3.23333,0,2,SER3,2024-05-28
,24,05,CMP,PCI,ENFXPCI10,MANEJO DE ROPA HOSPITALARIA,F329PCI,F329PCI_ERRORES EN EL ALMACENAMIENTO DE ROPA HOSPITALARIA,1.5,1,2.15556,3.23333,0,2,SER3,2024-05-28
,24,05,CMP,PCI,ENFXPCI10,MANEJO DE ROPA HOSPITALARIA,F330PCI,F330PCI_ROPA HOSPITALARIA ALMACENADA EN CONDICIONES NO HIGIENICAS,1.5,1,2.15556,3.23333,0,2,SER3,2024-05-28
,24,05,CMP,PCI,ENFXPCI10,MANEJO DE ROPA HOSPITALARIA,F331PCI,F331PCI_RECOLECCION DE ROPA SUCIA O CONTAMINADA SIN EQUIPO DE PROTECCION PERSONAL,2.21429,2,2.71111,12.0063,0,3,SER3,2024-05-28
,24,05,CMP,PCI,ENFXPCI10,MANEJO DE ROPA HOSPITALARIA,F332PCI,F332PCI_ROPA CONTAMINADA SIN ETIQUETA O DATOS DE IDENTIFICACION,1.5,1,2.15556,3.23333,0,2,SER3,2024-05-28
,24,05,CMP,PCI,ENFXPCI10,MANEJO DE ROPA HOSPITALARIA,F333PCI,F333PCI_ROPA SUCIA PRESENTE EN AREAS DE ATENCION A PACIENTE POR TIEMPO MAYOR AL ESTABLECIDO,1.5,1,2.15556,3.23333,0,2,SER3,2024-05-28
,24,05,CMP,PCI,ENFXPCI10,MANEJO DE ROPA HOSPITALARIA,F334PCI,F334PCI_RECOLECCION DE ROPA HOSPITALARIA FUERA DE RUTA U HORARIO ESTABLECIDO,1.5,1,2.15556,3.23333,0,2,SER3,2024-05-28
,24,05,CMP,PCI,ENFXPCI10,MANEJO DE ROPA HOSPITALARIA,F335PCI,F335PCI_NO CAMBIAR ROPA HOSPITALARIA ENTRE CADA PACIENTE QUE SE ATIENDA EN UNA MISMA UBICACION,1.5,1,2.15556,3.23333,0,2,SER3,2024-05-28
,24,05,CMP,PCI,ENFXPCI10,MANEJO DE ROPA HOSPITALARIA,F336PCI,"F336PCI_ROPA SUCIA DE UNIDADES DE AISLAMIENTO, PARTICULARMENTE POR CONTACTO, GOTAS O VIA AEREA NO IDENTIFICADAS SEGUN LO ESTABLECIDO POR LA ORGANIZACION",1.5,1,2.15556,3.23333,0,0,SER3,2024-05-28
,24,05,CMP,PCI,ENFXPCI10,MANEJO DE ROPA HOSPITALARIA,F337PCI,F337PCI_ROPA CONTAMINADA EN BOLSAS NO ES LLEVADA INMEDIATAMENTE AL SEPTICO DESPUES DE RETIRARLA ,1.5,1,2.15556,3.23333,0,2,SER3,2024-05-28
,24,05,CMP,PCI,ENFXPCI10,MANEJO DE ROPA HOSPITALARIA,F338PCI,F338PCI_DURANTE EL MANEJO O RECOLECCION DE ROPA SE AGITA LA ROPA PERMITIENDO LA DISPERSION DE MICROORGANISMOS,2.57143,3,3.26667,25.2,0,2,SER3,2024-05-28
,24,05,CMP,PCI,ENFXPCI10,MANEJO DE ROPA HOSPITALARIA,F339PCI,F339PCI_CARRO O TANICO CON MAS DEL LIMITE DE LA CAPACIDAD ESTABLECIDA POR LA ORGANIZACION,2.57143,3,3.26667,25.2,0,2,SER3,2024-05-28
,24,05,CMP,PCI,ENFXPCI10,MANEJO DE ROPA HOSPITALARIA,F340PCI,F340PCI_PROVEEDOR DE LAVADO Y DESINFECCION DE ROPA HOSPITALARIA NO CUMPLE CON ESPECIFICACIONES DE CALIDAD,2.57143,3,3.26667,25.2,0,2,SER3,2024-05-28
,24,05,CMP,PCI,ENFXPCI10,MANEJO DE ROPA HOSPITALARIA,F341PCI,F341PCI_LAVANDERIA NO CUENTA INSTALACIONES QUE EVITEN O REDUZCAN EL RIESGO DE CONTAMINACION ENTRE ROPA SUCIA Y LIMPIA,1.5,1,2.15556,3.23333,0,1,SER3,2024-05-28
,24,05,CMP,PCI,ENFXPCI4,NUTRICION Y COCINA,F107PCI,F107PCI_LAS PUERTAS Y VENTANAS DE LAS AREAS DE PRODUCCION O ELABORACION NO ESTAN PROVISTAS DE PROTECCIONES PAR EVITAR ENTRADA DE LLUVIA Y FAUNA NOCIVA,1.5,1,2.15556,3.23333,0,2,SER3,2024-05-28
,24,05,CMP,PCI,ENFXPCI4,NUTRICION Y COCINA,F108PCI,"F108PCI_LAS TUBERIAS, CONDUCTOS, RIELES, VIGAS ESTAN POR ENCIMA DE TANQUES Y AREAS DE PRODUCCION O ELABORACION DONDE EL PRODUCTO ESTE EXPUESTO",1.5,1,2.15556,3.23333,0,0,SER3,2024-05-28
,24,05,CMP,PCI,ENFXPCI4,NUTRICION Y COCINA,F109PCI,"F109PCI_LOS EQUIPOS INSTALADOS NO TIENEN EL ESPACIO ENTRE ELLOS MISMOS, LA PARED, EL TECHO Y PISO QUE PERMITAN SU LIMPIEZA Y DESINFECCION",1.5,1,2.15556,3.23333,0,2,SER3,2024-05-28
,24,05,CMP,PCI,ENFXPCI4,NUTRICION Y COCINA,F126PCI,F126PCI_LA ROPA Y OBJETOS PERSONALES NO SE GUARDAN FUERA DE LAS AREAS DE PRODUCCION O ELABORACION DE ALIMENTOS,1.5,1,2.15556,3.23333,0,2,SER3,2024-05-28
,24,05,CMP,PCI,ENFXPCI4,NUTRICION Y COCINA,F127PCI,"F127PCI_AL PERSONAL QUE MANIPULA ALIMENTOS, NO SE REALIZA CADA 6 MESES ESTUDIOS DE CONTROL",2.57143,5,4.37778,56.2857,0,2,SER3,2024-05-28
,24,05,CMP,PCI,ENFXPCI4,NUTRICION Y COCINA,F128PCI,"F128PCI_LOS ALIMENTOS NO SON TRANSPORTADOS EVITANDO LA CONTAMINACION FISICA, QUIMICA O BIOLOGICA",1.5,1,2.15556,3.23333,0,2,SER3,2024-05-28
,24,05,CMP,PCI,ENFXPCI4,NUTRICION Y COCINA,F129PCI,F129PCI_LOS VEHICULOS PARA TRANSPORTAR NO SE ENCUENTRAN LIMPIOS PARA EVITAR CONTAMINACION DE ALIMENTOS,2.57143,5,4.37778,56.2857,0,1,SER3,2024-05-28
,24,05,CMP,PCI,ENFXPCI4,NUTRICION Y COCINA,F131PCI,F131PCI_LA RECEPCION DE PRODUCTOS NO SE LLEVA A CABO UNICAMENTE POR LA ENTRADA DEL ALMACEN,1.5,1,2.15556,3.23333,0,1,SER3,2024-05-28
,24,05,CMP,PCI,ENFXPCI4,NUTRICION Y COCINA,F133PCI,"F133PCI_DURANTE LA RECEPCION DE PRODUCTOS, SE COLOCAN ALIMENTOS DIRECTAMENTE EN EL PISO",1.5,1,2.15556,3.23333,0,1,SER3,2024-05-28
,24,05,CMP,MMU,ENFXMMU2,RECEPCION Y REGISTRO DE MEDICAMENTOS,F18MMU,F18MMU_ERRORES EN LA RECEPCION Y REGISTRO DE MEDICAMENTOS Y DEMAS INSUMOS PARA LA SALUD,1.5,1,2.15556,3.23333,0,0,SER3,2024-05-28
,24,05,CMP,MUD,ENFXMUD2,RECEPCION Y REGISTRO DE INSUMOS PARA LA SALUD,F16MUD,F16MUD_ERRORES DE REGISTRO DE INSUMOS,1.5,1,2.15556,3.23333,0,0,SER3,2024-05-28
,24,05,CMP,ALM,ENFXALM2,RECEPCION Y REGISTRO,F14ALM,F14ALM_ERRORES DE REGISTRO DE INSUMOS,1.5,1,2.15556,3.23333,0,2,SER3,2024-05-28
,24,05,CMP,MMU,ENFXMMU4,GESTION DE INVENTARIOS DE FARMACIA,F37MMU,F37MMU_NO COINCIDENCIA CON LOS DIAS PROMEDIO DE INVENTARIO AUTORIZADOS,2.21429,5,4.37778,48.4683,0,1,SER3,2024-05-28
,24,05,CMP,MMU,ENFXMMU4,GESTION DE INVENTARIOS DE FARMACIA,F38MMU,F38MMU_NO COINCIDENCIA CON EL INDICE DE ROTACION DE INVENTARIO AUTORIZADO,1.5,1,2.15556,3.23333,0,0,SER3,2024-05-28
,24,05,CMP,MMU,ENFXMMU4,GESTION DE INVENTARIOS DE FARMACIA,F39MMU,F39MMU_DESVIACIONES ENTRE INVENTARIO FISICO E INVENTARIO EN SISTEMA,2.21429,5,4.37778,48.4683,0,1,SER3,2024-05-28
,24,05,CMP,FMS,ENFXFMS4.1,EQUIPO Y TECNOLOGIA BIOMEDICA_GESTION DE INVENTARIOS,F107FMS,"F107FMS_INVENTARIO DE EQUIPO O INSTRUMENTAL AUSENTE, INCOMPLETO, INCORRECTO O NO VIGENTE",1.5,1,2.15556,3.23333,0,2,SER3,2024-05-28
,24,05,CMP,FMS,ENFXFMS4.1,EQUIPO Y TECNOLOGIA BIOMEDICA_GESTION DE INVENTARIOS,F108FMS,F108FMS_EQUIPO O INSTERUMENTAL DISTRIBUIDO SIN CARTA DE RESGUARDO,1.5,1,2.15556,3.23333,0,2,SER3,2024-05-28
,24,05,CMP,FMS,ENFXFMS4.1,EQUIPO Y TECNOLOGIA BIOMEDICA_GESTION DE INVENTARIOS,F109FMS,F109FMS_EQUIPO O INSTRUMENTAL FUERA DE UBICACION AUTORIZADA,1.5,5,4.37778,32.8333,0,1,SER3,2024-05-28
,24,05,CMP,MUD,ENFXMUD4,GESTION DE INVENTARIOS DE INSUMOS PARA LA SALUD,F26MUD,F26MUD_NO COINCIDENCIA CON LOS DIAS PROMEDIO DE INVENTARIO AUTORIZADOS,2.21429,5,4.37778,48.4683,0,1,SER3,2024-05-28
,24,05,CMP,ALM,ENFXALM4,GESTION DE INVENTARIOS,F24ALM,F24ALM_NO COINCIDENCIA CON LOS DIAS PROMEDIO DE INVENTARIO AUTORIZADOS,1.5,1,2.15556,3.23333,0,1,SER3,2024-05-28
,24,05,CMP,ALM,ENFXALM4,GESTION DE INVENTARIOS,F26ALM,F26ALM_PRODUCTOS PERDIDOS,1.5,1,2.15556,3.23333,0,2,SER3,2024-05-28
,24,05,CMP,ALM,ENFXALM4,GESTION DE INVENTARIOS,F27ALM,"F27ALM_INVENTARIO DE EQUIPO O INSTRUMENTAL AUSENTE, INCOMPLETO, INCORRECTO O NO VIGENTE",1.5,1,2.15556,3.23333,0,1,SER3,2024-05-28
,24,05,CMP,ALM,ENFXALM4,GESTION DE INVENTARIOS,F29ALM,F29ALM_EQUIPO O INSTRUMENTAL FUERA DE UBICACION AUTORIZADA,1.5,1,2.15556,3.23333,0,1,SER3,2024-05-28
,24,05,CMP,ALM,ENFXALM1,SELECCION Y ADQUISICION,F2ALM,F2ALM_INSUMO SOLICITADO FUERA DE STOCK,1.5,1,2.15556,3.23333,0,2,SER3,2024-05-28
,24,05,CMP,ALM,ENFXALM1,SELECCION Y ADQUISICION,F4ALM,F4ALM_INCLUSION DE INSUMO SIN PREVIA AUTORIZACION,1.5,1,2.15556,3.23333,0,1,SER3,2024-05-28
,24,05,CMP,ALM,ENFXALM1,SELECCION Y ADQUISICION,F5ALM,F5ALM_BAJA DE INSUMO SIN PREVIA AUTORIZACION ,1.5,1,2.15556,3.23333,0,2,SER3,2024-05-28
,24,05,CMP,ALM,ENFXALM1,SELECCION Y ADQUISICION,F6ALM,F6ALM_OMISIONES O ERRORES EN EL REGISTRO DE CADUCIDAD EN LAS ENTRADAS DE INSUMOS,1.5,1,2.15556,3.23333,0,2,SER3,2024-05-28
,24,05,CMP,ALM,ENFXALM1,SELECCION Y ADQUISICION,F7ALM,F7ALM_RETRASO EN LA AUTORIZACION DE COMPRAS DE CUALQUIER TIPO,1.5,1,2.15556,3.23333,0,2,SER3,2024-05-28
,24,05,CMP,ALM,ENFXALM1,SELECCION Y ADQUISICION,F8ALM,F8ALM_DESABASTO DE INSUMOS,1.5,1,2.15556,3.23333,0,2,SER3,2024-05-28
,24,05,CMP,ALM,ENFXALM1,SELECCION Y ADQUISICION,F9ALM,F9ALM_RETRASO EN LA COMPRA DE INSUMOS EN SITUACIONES DE URGENCIA,1.5,1,2.15556,3.23333,0,2,SER3,2024-05-28
,24,05,CMP,ALM,ENFXALM1,SELECCION Y ADQUISICION,F10ALM,F10ALM_RETRASO EN LA COMPRA DE INSUMOS FUERA DE CUADRO BASICO,1.5,1,2.15556,3.23333,0,2,SER3,2024-05-28
,24,05,CMP,ALM,ENFXALM1,SELECCION Y ADQUISICION,F11ALM,F11ALM_ERRORES EN LOS DATOS DE LA FACTURA,1.5,1,2.15556,3.23333,0,2,SER3,2024-05-28
,24,05,CMP,ALM,ENFXALM1,SELECCION Y ADQUISICION,F12ALM,F12ALM_INCUMPLIMIENTO DE ESPECIFICACIONES DE CALIDAD DEL PROVEEDOR,1.5,1,2.15556,3.23333,0,2,SER3,2024-05-28
,24,05,ZAP1,EXPCLI,ENFXEXPCLI150,EXPEDIENTE CLINICO,F6EXPCLI,"F6EXPCLI_IDENTIFICACION DE PACIENTE PRESENTE, CORRECTA Y COMPLETA EN TODAS LAS HOJAS",1.85714,4,3.82222,28.3937,0,2,ENF2,2024-05-01
,24,05,ZAP1,EXPCLI,ENFXEXPCLI150,EXPEDIENTE CLINICO,F1EXPCLI,"F1EXPCLI_IDENTIFICADOR UNICO DE EXPEDIENTE PRESENTE, CORRECTO",1.5,1,2.15556,3.23333,0,3,ENF2,2024-05-04
,24,05,ZAP1,PCI,ENFXPCI1,PREVENCION DE ULCERAS POR PRESION,F1PCI,F1PCI_NO SE VALORA EL RIESGO DE ULCERAS POR ESCALAS CONOCIDAS,1.5,1,2.15556,3.23333,0,0,ENF2,2024-05-04
,24,05,ZAP1,MMU,ENFXMMU6,TRANSCRIPCION DE MEDICAMENTOS,F61MMU,F61MMU_TRANSCRIPCION A KARDEX DE ENFERMERIA INCORRECTA O INCOMPLETA,1.5,1,2.15556,3.23333,0,2,ENF2,2024-05-04
,24,05,ZAP1,MMU,ENFXMMU8,DISPENSACION Y DISTRIBUCION DE MEDICAMENTOS,F78MMU,F78MMU_LOS MEDICAMENTOS NO SE PREPARAN EN CONDICIONES SEGURAS E HIGIENICAS,1.5,1,2.15556,3.23333,0,1,ENF2,2024-05-04
,24,05,ZAP1,MMU,ENFXMMU10,ADMINISTRACION DE MEDICAMENTOS,F95MMU,F95MMU_MEDICAMENTO NO ADMINISTRADO,1.5,1,2.15556,3.23333,0,1,ENF2,2024-05-04
,24,05,ZAP1,PFE,ENFXPFE1,INTERVENCIONES DE EDUCACION,F6PFE,F6PFE_NO SE OTORGA EDUCACION RELACIONADA CON EL MANEJO DEL DOLOR,1.5,1,2.15556,3.23333,0,3,ENF2,2024-05-04
,24,05,ZAP1,PFE,ENFXPFE1,INTERVENCIONES DE EDUCACION,F14PFE,F14PFE_NO SE OTORGA EDUCACION RELACIONADA CON LOS MOMENTOS CRITICOS PARA IDENTIFICACION DE PACIENTE,1.5,1,2.15556,3.23333,0,0,ENF2,2024-05-04
,24,05,ZAP1,PFE,ENFXPFE1,INTERVENCIONES DE EDUCACION,F15PFE,F15PFE_NO SE OTORGA EDUCACION RELACIONADA CON LA HIGIENE DE MANOS,2.45238,4,3.82222,37.4942,0,4,ENF2,2024-05-04
,24,05,ZAP1,PFE,ENFXPFE1,INTERVENCIONES DE EDUCACION,F16PFE,F16PFE_NO SE OTORGA EDUCACION RELACIONADA CON LA PREVENCION DE CAIDAS,1.5,1,2.15556,3.23333,0,4,ENF2,2024-05-04
,24,05,ZAP1,ACC,ENFXACC9,TRASLADO DE PACIENTES,F44ACC,F44ACC_TRASLADO DE PACIENTE SIN PERSONAL CAPACITADO ,1.5,1,2.15556,3.23333,0,2,ENF2,2024-05-04
,24,05,ZAP1,AOP,ENFXAOP1,EVALUACION INICIAL EN PACIENTE HOSPITALIZADO,F4AOP,F4AOP_EVALUACION INICIAL DE ENFERMERIA NO REALIZADA DENTRO DE LAS PRIMERAS 24 HORAS DE INTERNAMIENTO,1.5,1,2.15556,3.23333,0,2,ENF2,2024-05-04
,24,05,ZAP1,AOP,ENFXAOP1,EVALUACION INICIAL EN PACIENTE HOSPITALIZADO,F6AOP,"F6AOP_EVALUACION DEL DOLOR AL PRIMER CONTACTO CLINICO AUSENTE, INCOMPLETA O INCORRECTA (INTENSIDAD FRECUENCIA, LOCALIZACION, DURACION)",1.5,1,2.15556,3.23333,0,1,ENF2,2024-05-04
,24,05,ZAP1,AOP,ENFXAOP3,EVALUACION INICIAL EN PACIENTE AMBULATORO,F27AOP,F27AOP_HISTORIA CLINICA NO REALIZADA ANTES DEL PROCEDIMIENTO O TRATAMIENTO MOTIVO DEL INGRESO,1.5,1,2.15556,3.23333,0,0,ENF2,2024-05-04
,24,05,ZAP1,AOP,ENFXAOP4,REVALORACION DE PACIENTE,F40AOP,"F40AOP_EVALUACION DE DOLOR A CAMBIO DE SERVICIO AUSENTE, INCOMPLETA O INCORRECTA (INTENSIDAD FRECUENCIA, LOCALIZACION, DURACION)",1.5,1,2.15556,3.23333,0,3,ENF2,2024-05-04
,24,05,ZAP1,COP,ENFXCOP2,REGISTRO DE INTERVENCIONES Y RESULTADOS,F18COP,"F18COP_INTERVENCIONES DE ENFERMERIA AUSENTES, INCORRECTAS O INCOMPLETAS EN EXPEDIENTE",1.5,1,2.15556,3.23333,0,0,ENF2,2024-05-04
,24,05,ZAP1,COP,ENFXCOP11,SUJECION DE PACIENTES,F125COP,"F125COP_REGISTRO DE INTERVENCION POR ENFERMERIA AUSENTE, INCOMPLETA O INCORRECTA EN EXPEDIENTE CLINICO",1.5,1,2.15556,3.23333,0,1,ENF2,2024-05-04
,24,05,ZAP1,ASC,ENFXASC1,ATENCION ANESTESICA,F9ASC,"F9ASC_MONITOREO DE PACIENTE DURANTE LA ANESTESIA AUSENTE, INCOMPLETO O INCORRECTO",1.5,1,2.15556,3.23333,0,0,ENF2,2024-05-04
,24,05,ZAP1,ASC,ENFXASC1,ATENCION ANESTESICA,F16ASC,F16ASC_EL ANESTESIOLOGO NO REALIZA LA VERIFICACION PREPROCEDIMIENTO,1.5,1,2.15556,3.23333,0,0,ENF2,2024-05-04
,24,05,ZAP1,ASC,ENFXASC2,ATENCION QUIRURGICA,F22ASC,"F22ASC_REGISTROS PREOPERATORIOS DE ENFERMERIA AUSENTES, INCOMPLETOS O INCORRECTOS",1.5,1,2.15556,3.23333,0,1,ENF2,2024-05-04
,24,05,ZAP1,ACC,ENFXACC2,ACEPTACION DE PACIENTES,F7ACC,F7ACC_PACIENTE INGRESA A QUIROFANO PARA PROCEDIMIENTOS MAYORES SIN CUMPLIR CON CRITERIOS DE ACEPTACION,1.5,1,2.15556,3.23333,0,0,ENF2,2024-05-09
,24,05,ZAP1,ACC,ENFXACC4,INFORMES A PACIENTE O FAMILAR,F11ACC,"F11ACC_LA INFORMACION AL PACIENTE O FAMILIAR DURANTE EL INGRESO ES AUSENTE, TARDIA, INCOMPLETA O INCORRECTA",1.5,1,2.15556,3.23333,0,0,ENF2,2024-05-09
,24,05,ZAP1,SQE,ENFXSQE10,DOCUMENTACION DEL PERSONAL ,F80SQE,"F80SQE_EVIDENCIA DE CAPACITACION BRINDADA POR LA ORGANIZACION AUSENTE, INCOMPLETA, INCORRECTA O DESACTUALIZADA",1.5,1,2.15556,3.23333,0,10,ENF2,2024-04-15
,24,05,ZAP1,MMU,ENFXMMU8,DISPENSACION Y DISTRIBUCION DE MEDICAMENTOS,F83MMU,F83MMU_A LA DISPENSACION O DISTRIBUCION SE IDENTIFICA QUE EL MEDICAMENTO NO CORRESPONDE CON LO INDICADO O SOLICITADO,1.85714,5,4.37778,40.6508,0,1,FAR2,2024-05-31
,24,05,TM2,FMS,ENFXFMS1,PROTECCION DE LA ORGANIZACION,F1FMS,"F1FMS_EVIDENCIA DE INSPECCION INTEGRAL Y COMPLETA DE LAS INSTALACIONES PARA IDENTIFICAR NECESIDADES DE MANTENIMIENTO, SUSTITUCION O ACTUALIZACION AUSENTE INCOMPLETA O INCORRECTA",2.57143,4,3.82222,39.3143,0,3,SER1,2024-05-31
,24,05,TM2,FMS,ENFXFMS1,PROTECCION DE LA ORGANIZACION,F2FMS,"F2FMS_EVIDENCIA ANUAL DE INSPECCIONES DE INSTALACIONES DESPUES DE UN SINIESTRO AUSENTE, INCOMPLETA O INCORRECTA",1.5,1,2.15556,3.23333,0,2,SER1,2024-05-31
,24,05,TM2,FMS,ENFXFMS1,PROTECCION DE LA ORGANIZACION,F3FMS,"F3FMS_EVIDENCIA ANUAL DE INSPECCIONES DE INSTALACIONES DESPUES DE UNA REMODELACION O CONSTRUCCION AUSENTE, INCOMPLETA O INCORRECTA",1.5,1,2.15556,3.23333,0,2,SER1,2024-05-31
,24,05,TM2,FMS,ENFXFMS1,PROTECCION DE LA ORGANIZACION,F4FMS,"F4FMS_EVIDENCIA DE CUMPLIMIENTO DE PROGRAMA DE MANTENIMIENTO PREVENTIVO AUSENTE, INCOMPLETA O INCORRECTA",1.5,1,2.15556,3.23333,0,2,SER1,2024-05-31
,24,05,TM2,FMS,ENFXFMS1,PROTECCION DE LA ORGANIZACION,F5FMS,"F5FMS_IDENTIFICACION DE RIESGOS POR ACTOS Y CONDICIONES INSEGURAS PREVIO A INICIAR CONSTRUCCION O REMODELACION AUSENTES, INCOMPLETA O INCORRECTA",1.5,3,3.26667,14.7,0,0,SER1,2024-05-31
,24,05,TM2,FMS,ENFXFMS1,PROTECCION DE LA ORGANIZACION,F7FMS,"F7FMS_IDENTIFICACION DE RIESGOS POR FUEGO Y HUMO PREVIO A INICIAR CONSTRUCCION O REMODELACION AUSENTES, INCOMPLETA O INCORRECTA",1.5,1,2.15556,3.23333,0,0,SER1,2024-05-31
,24,05,TM2,FMS,ENFXFMS1,PROTECCION DE LA ORGANIZACION,F8FMS,"F8FMS_IDENTIFICACION DE RIESGOS DE ACTIVIDADES DE QUE AFECTAN LA OPERACION PREVIO A INICIAR CONSTRUCCION O REMODELACION AUSENTES, INCOMPLETA O INCORRECTA",2.57143,5,4.37778,56.2857,0,1,SER1,2024-05-31
,24,05,TM2,FMS,ENFXFMS1,PROTECCION DE LA ORGANIZACION,F10FMS,"F10FMS_IDENTIFICACION DE RIESGOS A INFECCIONES NOSOCOMIALES PREVIO A INICIAR CONSTRUCCION O REMODELACION AUSENTES, INCOMPLETA O INCORRECTA",2.57143,5,4.37778,56.2857,0,3,SER1,2024-05-31
,24,05,TM2,FMS,ENFXFMS1,PROTECCION DE LA ORGANIZACION,F13FMS,"F13FMS_POSTERIOR A UNA REMODELACION O CONSTRUCCION, INICIAR OPERACION SIN GARANTIZAR LAS CONDICIONES DE SEGURIDAD",1.5,1,2.15556,3.23333,0,0,SER1,2024-05-31
,24,05,TM2,FMS,ENFXFMS1.1,PROTECCION DE LA ORGANIZACION_SEGURIDAD Y SALUD,F20FMS,"F20FMS_SEÑALAMIENTOS PARA PREVENCION DE ACTOS O CONDICIONES INSEGURAS NO VISIBLES, AUSENTES, MALTRATADOS O EQUIVOCADOS",2.57143,5,4.37778,56.2857,0,3,SER1,2024-05-31
,24,05,TM2,FMS,ENFXFMS1,PROTECCION DE LA ORGANIZACION,F15FMS,F15FMS_PROVEEDOR DE REMODELACION O CONSTRUCCION NO CUMPLE CON ESPECIFICACIONES DE CALIDAD,2.21429,5,4.37778,48.4683,0,1,SER1,2024-05-31
,24,05,TM2,FMS,ENFXFMS6,EMERGENCIAS EXTERNAS,F179FMS,"F179FMS_EVIDENCIA DE AL MENOS UN SIMULACRO AL AÑO DE EVACUACION AUSENTE, INCOMPLETA O INCORRECTA",1.5,1,2.15556,3.23333,0,0,SER1,2024-05-31
,24,05,TM2,FMS,ENFXFMS6,EMERGENCIAS EXTERNAS,F176FMS,F176FMS_ERRORES EN LA OPERACION DE LAS BRIGADAS DURANTE SITUACIONES DE EMERGENCIA O DESASTRE,1.5,1,2.15556,3.23333,0,0,SER1,2024-05-31
,24,05,TM2,FMS,ENFXFMS6,EMERGENCIAS EXTERNAS,F173FMS,F173FMS_ERRORES DE ACTUACION DURANTE LA RESPUESTA A SITUACIONES DE EMERGENCIAS O DESASTRES,1.5,1,2.15556,3.23333,0,0,SER1,2024-05-31
,24,05,TM2,FMS,ENFXFMS1.1,PROTECCION DE LA ORGANIZACION_SEGURIDAD Y SALUD,F26FMS,F26FMS_NO UTILIZAR ROPA O CALZADO ADECUADO PARA LAS ACTIVIDADES A REALIZAR DENTRO DE LAS INSTALACIONES,1.5,1,2.15556,3.23333,0,0,SER1,2024-05-31
,24,05,TM2,FMS,ENFXFMS1.1,PROTECCION DE LA ORGANIZACION_SEGURIDAD Y SALUD,F27FMS,F27FMS_AREAS RESTRINGIDAS SIN CONTROL DE ACCESO,1.5,1,2.15556,3.23333,0,0,SER1,2024-05-31
,24,05,TM2,FMS,ENFXFMS5,SERVICIOS PRIORITARIOS PARA LA OPERACION,F159FMS,F159FMS_ALTERNATIVAS DE SUMINISTRO DE SERVICIOS PRIORITARIOS EN CASO DE FALLAS O EMERGENCIAS NO FUNCIONALES,2.57143,5,4.37778,56.2857,0,1,SER1,2024-05-31
,24,05,TM2,FMS,ENFXFMS1,PROTECCION DE LA ORGANIZACION,F45FMS,F45FMS_EQUIPOS DE LA EMPRESA DENTRO DE LAS INSTALACIONES SIN CONTROL DE EGRESO,1.5,1,2.15556,3.23333,0,0,SER1,2024-05-31
,24,05,TM2,FMS,ENFXFMS5,SERVICIOS PRIORITARIOS PARA LA OPERACION,F155FMS,"F155FMS_EVALUACION DE SERVICIOS SUBROGADOS AUSENTE, INCOMPLETA O INCORRECTA",2.57143,5,4.37778,56.2857,0,1,SER1,2024-05-31
,24,05,TM2,FMS,ENFXFMS1.1,PROTECCION DE LA ORGANIZACION_SEGURIDAD Y SALUD,F31FMS,F31FMS_RUTINAS DE VIGILANCIA NO CUMPLIDAS,1.5,1,2.15556,3.23333,0,1,SER1,2024-05-31
,24,05,TM2,PCI,ENFXPCI8,LIMPIEZA Y DESINFECCION DE INSTALACIONES Y MEDIOS DE TRANSPORTE,F266PCI,"F266PCI_PROGRAMA DE EXHAUSTIVOS DE VEHICULOS PARA TRANSPORTE AUSENTE, INCOMPLETO O INCORRECTO",1.5,1,2.15556,3.23333,0,0,SER1,2024-05-31
,24,05,TM2,ALM,ENFXALM5,DISTRIBUCION,F31ALM,F31ALM_OMISIONES O ERRORES EN EL REGISTRO DE SALIDAS,1.5,1,2.15556,3.23333,0,0,SER1,2024-05-31
,24,05,TM2,ALM,ENFXALM5,DISTRIBUCION,F34ALM,"F34ALM_INSUMO, EQUIPO O MATERIAL NO CLINICO DISTRIBUIDO SIN CARTA DE RESGUARDO",1.5,1,2.15556,3.23333,0,0,SER1,2024-05-31
,24,05,TM2,ALM,ENFXALM5,DISTRIBUCION,F32ALM,F32ALM_ERRORES EN LA DISTRIBUCION,1.5,1,2.15556,3.23333,0,1,SER1,2024-05-31
,24,05,TM2,ALM,ENFXALM2,RECEPCION Y REGISTRO,F13ALM,F13ALM_ERRORES EN LA RECEPCION Y REGISTRO DE INSUMOS,1.5,1,2.15556,3.23333,0,0,SER1,2024-05-31
,24,05,TM2,GLD,ENFXGLD6,RUTINAS GERENCIALES,F32GLD,F32GLD_NO SE SUPERVISAN DE MANERA CONTINUA LOS SERVICIOS SUBROGADOS,1.5,1,2.15556,3.23333,0,2,SER1,2024-05-31
,24,05,CMP,ALM,ENFXALM1,SELECCION Y ADQUISICION,F1ALM,F1ALM_CUADRO BASICO DE INSUMOS NO DISPONIBLE EN LAS AREAS DE PRESCRIPCION,1.5,1,2.15556,3.23333,0,0,SER3,2024-05-31
,24,06,TM2,SQE,ENFXSQE5,ORIENTACION,F32SQE,"F32SQE_EVIDENCIA DE INDUCCION A PERSONAL DE NUEVO INGRESO AUSENTE, INCOMPLETA O INCORRECTA (BARRERAS DE SEGURIDAD, DEFINICIONES OPERATIVAS DE EVENTOS, PREVENCION DE INFECCIONES, EQUIPO DE PROTECCION PERSONAL, COMUNICACIÓN DE RIESGOS Y PELIGROS DE SEGURIDAD)",2.72449,3,3.26667,26.7,0,29,RH3,2024-05-31
,24,06,ZAP1,PCI,ENFXPCI2.7,VIGILANCIA EPIDEMIOLOGICA_LINEAS VASCULARES,F48PCI,F48PCI_NO REALIZA ASEPSIA CORRECTA EN EL SITIO DE INSERCION,1.5,1,2.15556,3.23333,0,0,ENF2,2024-06-11
,24,06,ZAP1,PCI,ENFXPCI2.7,VIGILANCIA EPIDEMIOLOGICA_LINEAS VASCULARES,F50PCI,F50PCI_NO COLOCAR MEMBRETE DE IDENTIFICACION,1.5,1,2.15556,3.23333,0,0,ENF2,2024-06-11
,24,06,ZAP1,PCI,ENFXPCI3.1,RIESGO DE TRANSMISION_EPP,F87PCI,F87PCI_AL REALIZAR UN PROCEDIMIENTO ASEPTICO O ESTERIL EL PERSONAL NO USA GUANTES,1.5,1,2.15556,3.23333,0,0,ENF2,2024-06-11
,24,06,ZAP1,PCI,ENFXPCI3.1,RIESGO DE TRANSMISION_EPP,F88PCI,F88PCI_AL REALIZAR UN PROCEDIMIENTO ASEPTICO O ESTERIL EL PERSONAL NO USA CUBREBOCAS,1.5,1,2.15556,3.23333,0,0,ENF2,2024-06-11
,24,06,ZAP1,PCI,ENFXPCI4,NUTRICION Y COCINA,F124PCI,"F124PCI_NO TIENEN UÑAS CORTAS, SIN ESMALTE, SIN UÑAS POSTIZAS",1.5,1,2.15556,3.23333,0,0,ENF2,2024-06-11
,24,06,ZAP1,PCI,ENFXPCI9,MANEJO DE RPBI,F288PCI,F288PCI_MATERIAL PUNZOCORTANTE NO SE CLASIFICA EN CONTENEDORES RIGIDOS ROJO PARA DESECHO,1.5,1,2.15556,3.23333,0,0,ENF2,2024-06-11
,24,06,ZAP1,PCI,ENFXPCI9,MANEJO DE RPBI,F313PCI,F313PCI_ERRORES EN LA CLASIFICACION DE RPBI,1.5,1,2.15556,3.23333,0,0,ENF2,2024-06-11
,24,06,ZAP1,PCI,ENFXPCI2.7,VIGILANCIA EPIDEMIOLOGICA_LINEAS VASCULARES,F52PCI,F52PCI_NO LAVAR VIA VENOSA DESPUES DE LA ADMINISTRACION DE MEDICAMENTOS Y/O HEMODERIVADOS,1.5,1,2.15556,3.23333,0,6,ENF2,2024-06-11
,24,06,ZAP1,GLD,ENFXGLD1,GOBIERNO,F10GLD,F10GLD_FALTA DE EQUIPOS Y TECNOLOGIAS PARA BRINDAR SERVICIOS,1.5,1,2.15556,3.23333,0,4,GEM2,2024-05-31
,24,06,ZAP1,GLD,ENFXGLD1,GOBIERNO,F9GLD,F9GLD_FALTA DE RECURSOS HUMANOS PARA BRINDAR SERVICIOS,1.5,3,3.26667,14.7,0,0,GEM2,2024-05-31
,24,06,ZAP1,GLD,ENFXGLD11,TAREAS,F73GLD,F73GLD_TAREAS NO CUMPLIDAS,3.64285,3,3.26667,35.7,0,136,GEM2,2024-05-31
,24,06,ZAP1,GLD,ENFXGLD11,TAREAS,F74GLD,F74GLD_TAREAS CUMPLIDAS  A DESTIEMPO,3.64285,5,4.37778,79.738,0,21,GEM2,2024-05-31
,24,06,ZAP1,GLD,ENFXGLD6,RUTINAS GERENCIALES,F43GLD,F43GLD_LOS RESPONSABLES DE LAS AREAS O SERVICIOS NO RESUELVEN ANTE LA ESCASEZ DE RECURSOS HUMANOS O MATERIALES,1.5,1,2.15556,3.23333,0,0,GEM2,2024-05-31
,24,06,ZAP1,GLD,ENFXGLD7,DIRECCION_CAPACITACION,F44GLD,"F44GLD_LOS RESPONSABLES DE LAS AREAS O SERVICIOS NO PARTICIPAN ACTIVAMENTE EN LA IDENTIFICACION DE NECESIDADES DE EDUCACION, DESTREZAS, CONOCIMIENTO Y EXPERIENCIAS PARA DETERMINACION DE LOS PERFILES DE PUESTO",1.5,1,2.15556,3.23333,0,0,GEM2,2024-05-31
,24,06,ZAP1,GLD,ENFXGLD7,DIRECCION,F47GLD,"F47GLD_LA INDUCCION AL PERSONAL GARANTIZADA POR LOS RESPONSABLES DE LOS DEPARTAMENTOS O SERVICIOS NO EXISTE, ESTA INCOMPLETA O INCORRECTA",1.5,3,3.26667,14.7,0,0,GEM2,2024-05-31
,24,06,ZAP1,GLD,ENFXGLD8,LINEAMIENTOS OPERATIVOS,F48GLD,"F48GLD_LOS RESPONSABLES DE LOS DEPARTAMENTOS O SERVICIOS NO PARTICIPAN ACTIVAMENTE EN LA ELABORACION DE PLANES, LINEAMIENTOS, PROCESOS Y PROCEDIMIENTOS OPERATIVOS",1.5,1,2.15556,3.23333,0,0,GEM2,2024-05-31
,24,06,ZAP1,GLD,ENFXGLD8,LINEAMIENTOS OPERATIVOS,F49GLD,"F49GLD_LOS RESPONSABLES DE LOS DEPARTAMENTOS O SERVICIOS NO PARTICIPAN ACTIVAMENTE EN EL CUMPLIMIENTO CON LOS LINEAMIENTOS, PROCESOS Y PROCEDIMIENTOS OPERATIVOS",1.5,1,2.15556,3.23333,0,0,GEM2,2024-05-31
,24,06,ZAP1,GLD,ENFXGLD6,RUTINAS GERENCIALES,F51GLD,F51GLD_LOS RESPONSABLES DE LOS DEPARTAMENTOS O SERVICIOS NO SUPERVISAN SUS PROCESOS,1.5,1,2.15556,3.23333,0,0,GEM2,2024-05-31
,24,06,ZAP1,GLD,ENFXGLD6,RUTINAS GERENCIALES,F53GLD,F53GLD_LOS LIDERES NO CUMPLEN CON SUS FUNCIONES,1.5,1,2.15556,3.23333,0,0,GEM2,2024-05-31
,24,06,ZAP1,GLD,ENFXGLD7,DIRECCION_RIESGOS,F54GLD,F54GLD_LOS RESPONSABLES DE LOS DEPARTAMENTOS O SERVICIOS NO IDENTIFICAN SUS RIESGOS,1.5,1,2.15556,3.23333,0,0,GEM2,2024-05-31
,24,06,ZAP1,GLD,ENFXGLD7,DIRECCION_TAREAS,F55GLD,F55GLD_LOS RESPONSABLES DE LOS DEPARTAMENTOS O SERVICIOS NO CUMPLEN SUS COMPROMISOS,1.5,1,2.15556,3.23333,0,0,GEM2,2024-05-31
,24,06,ZAP1,GLD,ENFXGLD9,DIRECCION_JUNTA OPERATIVA,F57GLD,F57GLD_LOS RESPONSABLES DE LOS DEPARTAMENTOS O SERVICIOS NO RESUELVEN LOS PROBLEMAS OPERATIVOS,1.5,1,2.15556,3.23333,0,0,GEM2,2024-05-31
,24,07,ZAP1,MISP,ENFXMISP1,IDENTIFICACION DE PACIENTE,F1MISP,F1MISP_NO SE CONFIRMA VERBALMENTE DATOS DE IDENTIFICACION DE PACIENTE CON PACIENTE O FAMILIAR AL PRIMER CONTACTO,1.5,1,2.15556,3.23333,0,5,ENF2,2024-06-01
,24,07,ZAP1,SQE,ENFXSQE2,EXPEDIENTE DE PERSONAL CLINICO,F13SQE,"F13SQE_VERIFICACION DE FUENTE ORIGINAL DE PERSONAL CLINICO AUSENTE, INCOMPLETA O INCORRECTA",1.5,1,2.15556,3.23333,0,20,RH1,2024-06-03
,24,07,ZAP1,MISP,ENFXMISP1,IDENTIFICACION DE PACIENTE,F2MISP,F2MISP_NO SE REGISTRA CONFIRMACION DE IDENTIFICACION DE PACIENTE AL PRIMER CONTACTO CLINICO EN EXPEDIENTE,1.5,1,2.15556,3.23333,0,10,ENF2,2024-06-01
,24,07,ZAP1,MISP,ENFXMISP1,IDENTIFICACION DE PACIENTE,F3MISP,"F3MISP_ETIQUETAS O IDENTIFICADORES CON DATOS DE IDENTIFICACION DE PACIENTE AUSENTES, INCOMPLETOS O INCORRECTOS",2.92857,1,2.15556,6.3127,0,9,ENF2,2024-06-01
,24,07,ZAP1,MISP,ENFXMISP1,IDENTIFICACION DE PACIENTE,F8MISP,F8MISP_ETIQUETA DE MEDICAMENTO NO COINCIDE CON IDENTIFICACION DE PACIENTE ,1.5,1,2.15556,3.23333,0,8,ENF2,2024-06-01
,24,07,ZAP1,MISP,ENFXMISP1,IDENTIFICACION DE PACIENTE,F9MISP,F9MISP_ETIQUETA DE INFUSION INTRAVENOSA NO COINCIDE CON IDENTIFICACION DE PACIENTE ,1.5,1,2.15556,3.23333,0,5,ENF2,2024-06-01
,24,07,ZAP1,MISP,ENFXMISP4,PROCEDIMIENTOS CORRECTOS,F61MISP,F61MISP_COLOCACION DE ACCESOS VASCULARES REALIZAR NO COINCIDE CON PACIENTE CORRECTO,1.5,1,2.15556,3.23333,0,2,ENF2,2024-06-01
,24,07,ZAP1,MISP,ENFXMISP1,IDENTIFICACION DE PACIENTE,F20MISP,F20MISP_PROCEDIMIENTO O TRATAMIENTO INVASIVO Y DE ALTO RIESGO NO COINCIDE CON IDENTIFICACION DE PACIENTE CORRECTO,1.5,1,2.15556,3.23333,0,5,ENF2,2024-06-01
,24,07,ZAP1,MISP,ENFXMISP4,PROCEDIMIENTOS CORRECTOS,F41MISP,F41MISP_MARCADO FISICO DEL SITIO QUIRURGICO AUSENTE O INCORRECTO PREVIO A INICIAR PROCEDIMIENTO,2.92857,5,4.37778,64.1032,0,1,ENF2,2024-06-01
,24,07,ZAP1,MISP,ENFXMISP4,PROCEDIMIENTOS CORRECTOS,F49MISP,"F49MISP_PREVIO A PROCEDIMIENTO QUIRURGICOS, REQUERIMIENTOS O EQUIPOS NO DISPONIBLES O CONDICIONES CLINICAS NO IDENTIFICADAS ",1.5,1,2.15556,3.23333,0,5,ENF2,2024-06-01
,24,07,ZAP1,MISP,ENFXMISP4,PROCEDIMIENTOS CORRECTOS,F55MISP,F55MISP_PROCEDIMIENTO QUIRURGICO A REALIZAR NO COINCIDE CON PACIENTE CORRECTO,1.5,1,2.15556,3.23333,0,3,ENF2,2024-06-01
,24,07,ZAP1,MISP,ENFXMISP4,PROCEDIMIENTOS CORRECTOS,F63MISP,F63MISP_PACIENTE EGRESA DE SALA QUIRURGICA EN CONDICIONES INSEGURAS,1.5,1,2.15556,3.23333,0,4,ENF2,2024-06-01
